idArticulo,dsArticulo,marca_linea,proveedor_ref,grupo,familia,linea
100,PALLETS IN/OUT,SIN AGRUPACIÓN,SIN AGRUPACIÓN,SIN AGRUPACIÓN,SIN AGRUPACIÓN,SIN AGRUPACIÓN
101,ALMAC. CONGELADOS PAL/DIA,SIN AGRUPACIÓN,SIN AGRUPACIÓN,SIN AGRUPACIÓN,SIN AGRUPACIÓN,SIN AGRUPACIÓN
1000,VIANDAS DE REFRIGERIO,SIN PROVEEDOR,SIN PROVEEDOR,SIN AGRUPACIÓN,SIN AGRUPACIÓN,SIN CATEGORIA
1001,MC CAIN TRADICIONAL X 2.5 KG,SIN AGRUPACIÓN,SIN AGRUPACIÓN,SIN AGRUPACIÓN,SIN AGRUPACIÓN,SIN AGRUPACIÓN
1002,QUESO CHEDDAR EN FETAS MILKAUT,SIN AGRUPACIÓN,SIN AGRUPACIÓN,SIN AGRUPACIÓN,SIN AGRUPACIÓN,SIN AGRUPACIÓN
1025,CREMA DE LECHE 44% LA PAULINA X 5 LT,MOLFINO HNOS S.A.,MOLFINO HNOS S.A.,REFRIGERADOS,LACTEOS,PAULINA LACTEOS
1027,Q. MOZZA P/FETEAR X KG LA PAULINA,MOLFINO HNOS S.A.,MOLFINO HNOS S.A.,REFRIGERADOS,QUESOS,PAULINA LACTEOS
1029,CREMA DE LECHE 39% LA PAULINA X 5 LT,MOLFINO HNOS S.A.,MOLFINO HNOS S.A.,REFRIGERADOS,LACTEOS,PAULINA LACTEOS
1069,MANT. LA PAULINA X 5 KG,MOLFINO HNOS S.A.,MOLFINO HNOS S.A.,REFRIGERADOS,LACTEOS,PAULINA LACTEOS
1079,Q. BARRA DAMBO X KG LA PAULINA,MOLFINO HNOS S.A.,MOLFINO HNOS S.A.,REFRIGERADOS,QUESOS,PAULINA LACTEOS
1109,Q. REGGIANITO HORMA X KG LA PAULINA,MOLFINO HNOS S.A.,MOLFINO HNOS S.A.,REFRIGERADOS,QUESOS,PAULINA LACTEOS
1203,Q. CHEDDAR POUCH X 3.7 KG LA PAULINA,MOLFINO HNOS S.A.,MOLFINO HNOS S.A.,REFRIGERADOS,QUESOS,PAULINA LACTEOS
1215,Q. CREMA POUCH  X 4 KG LA PAULINA,MOLFINO HNOS S.A.,MOLFINO HNOS S.A.,REFRIGERADOS,QUESOS,PAULINA LACTEOS
1500,PATITA DE POLLO GRANGYS X 5KG,GONZALEZ PABLO,GONZALEZ PABLO,CONGELADOS,REBOZADOS,GRANGYS CONGELADOS
1501,MEDALLON POLLO J-Q GRANGYS X 5KG,GONZALEZ PABLO,GONZALEZ PABLO,CONGELADOS,REBOZADOS,GRANGYS CONGELADOS
1502,MEDALLON POLLO GRANGYS X 5KG,GONZALEZ PABLO,GONZALEZ PABLO,CONGELADOS,REBOZADOS,GRANGYS CONGELADOS
1503,MEDALLON MERLUZA GRANGYS X 5KG,GONZALEZ PABLO,GONZALEZ PABLO,CONGELADOS,REBOZADOS,GRANGYS CONGELADOS
1504,MEDALLON MERLUZA E-Q GRANGYS X 5KG,GONZALEZ PABLO,GONZALEZ PABLO,CONGELADOS,REBOZADOS,GRANGYS CONGELADOS
1506,NUGGETS CROCANTE GRANGYS X 6 KG,GONZALEZ PABLO,GONZALEZ PABLO,CONGELADOS,REBOZADOS,GRANGYS CONGELADOS
1507,BOCADITO ESPINACA GRANGYS X 5 KG,GONZALEZ PABLO,GONZALEZ PABLO,CONGELADOS,REBOZADOS,GRANGYS CONGELADOS
1508,MEDALLON POLLO E-Q GRANGYS X 5KG,GONZALEZ PABLO,GONZALEZ PABLO,CONGELADOS,REBOZADOS,GRANGYS CONGELADOS
1509,BOCADITO CALABAZA GRANGYS X 5 KG,GONZALEZ PABLO,GONZALEZ PABLO,CONGELADOS,REBOZADOS,GRANGYS CONGELADOS
1511,CAÑONCITOS DE MUZZARELLA GRANGYS X 6 KG,GONZALEZ PABLO,GONZALEZ PABLO,CONGELADOS,REBOZADOS,GRANGYS CONGELADOS
1512,DINOS DE POLLO GRANGYS X 5 KG,GONZALEZ PABLO,GONZALEZ PABLO,CONGELADOS,REBOZADOS,GRANGYS CONGELADOS
1530,MEDALLON POLLO GRANGYS X 430 GRS,GONZALEZ PABLO,GONZALEZ PABLO,CONGELADOS,REBOZADOS,GRANGYS RETAIL
1531,MEDALLON POLLO J-Q GRANGYS X 430 GRS,GONZALEZ PABLO,GONZALEZ PABLO,CONGELADOS,REBOZADOS,GRANGYS RETAIL
1532,NUGGETS CROCANTE GRANGYS X 400 GRS,GONZALEZ PABLO,GONZALEZ PABLO,CONGELADOS,REBOZADOS,GRANGYS RETAIL
1533,DINOS DE POLLO GRANGYS X 400 GRS,GONZALEZ PABLO,GONZALEZ PABLO,CONGELADOS,REBOZADOS,GRANGYS RETAIL
1534,BOCADITO DE POLLO GRANGYS X 400 GRS,GONZALEZ PABLO,GONZALEZ PABLO,CONGELADOS,REBOZADOS,GRANGYS RETAIL
1620,FRUTOS ROJOS X 500 GRS BIOMAC,BIOMAC SRL,BIOMAC SRL,CONGELADOS,SALUDABLES,BIOMAC FOOD SERVICE
1621,FRUTILLA X 500 GRS BIOMAC,BIOMAC SRL,BIOMAC SRL,CONGELADOS,SALUDABLES,BIOMAC FOOD SERVICE
1622,MARACUYA CON-SEMILLA X 500 GRS BIOMAC,BIOMAC SRL,BIOMAC SRL,CONGELADOS,SALUDABLES,BIOMAC FOOD SERVICE
1623,FRUTOS DEL BOSQUE X 500 GRS BIOMAC,BIOMAC SRL,BIOMAC SRL,CONGELADOS,SALUDABLES,BIOMAC FOOD SERVICE
1634,Q. PATEGRAS X KG LA PAULINA,MOLFINO HNOS S.A.,MOLFINO HNOS S.A.,REFRIGERADOS,QUESOS,PAULINA LACTEOS
1807,MANT. PRIMER PREMIO X 100 GRS (X 6KG),ALTO ALEGRE DOBLE A SA,ALTO ALEGRE DOBLE A SA,REFRIGERADOS,LACTEOS,DOBLE A LACTEOS
1808,MANT. PRIMER PREMIO X 200 GRS (X 6KG),ALTO ALEGRE DOBLE A SA,ALTO ALEGRE DOBLE A SA,REFRIGERADOS,LACTEOS,DOBLE A LACTEOS
1905,MANT. X 5 KG MILKAUT,MILKAUT SA,MILKAUT SA,REFRIGERADOS,LACTEOS,MILKAUT LACTEOS
2000,Q. PROV HORMA X KG NONNA PIA,PARRILAC S.R.L,PARRILAC S.R.L,REFRIGERADOS,QUESOS,NONNA PIA LACTEOS
2005,Q. PROV FRACC C/CAZ X KG NONNA PIA,PARRILAC S.R.L,PARRILAC S.R.L,REFRIGERADOS,QUESOS,NONNA PIA LACTEOS
2009,Q. CAMPO SABORIZADOS MIX NONNA PIA,PARRILAC S.R.L,PARRILAC S.R.L,REFRIGERADOS,QUESOS,NONNA PIA LACTEOS
2010,Q. SARDO FRESCO X KG NONNA PIA,PARRILAC S.R.L,PARRILAC S.R.L,REFRIGERADOS,QUESOS,NONNA PIA LACTEOS
2012,Q. PARMESANO HORMA X KG NONNA PIA,PARRILAC S.R.L,PARRILAC S.R.L,REFRIGERADOS,QUESOS,NONNA PIA LACTEOS
2961,PIZZA MUZZARELLA 25CM X 449 GRS,GF ALIMENTOS S.R.L.,GF ALIMENTOS S.R.L.,CONGELADOS,PIZZA,GLUFREEZ CONGELADOS
2962,PIZZA FUGAZZETTA 25CM X 449 GRS,GF ALIMENTOS S.R.L.,GF ALIMENTOS S.R.L.,CONGELADOS,PIZZA,GLUFREEZ CONGELADOS
2963,PIZZA JAMÓN Y PROVOLONE 25CM X 449 GRS,GF ALIMENTOS S.R.L.,GF ALIMENTOS S.R.L.,CONGELADOS,PIZZA,GLUFREEZ CONGELADOS
6002,Q. CRIOLLO X KG TREGAR,GARCIA HNOS AGROINDUSTRIAL SRL QUESOS,GARCIA HNOS AGROINDUSTRIAL SRL,REFRIGERADOS,QUESOS,TREGAR QUESOS
6007,Q. POR SALUT X KG TREGAR,GARCIA HNOS AGROINDUSTRIAL SRL QUESOS,GARCIA HNOS AGROINDUSTRIAL SRL,REFRIGERADOS,QUESOS,TREGAR QUESOS
6009,Q. CREMOSO X KG TREGAR,GARCIA HNOS AGROINDUSTRIAL SRL QUESOS,GARCIA HNOS AGROINDUSTRIAL SRL,REFRIGERADOS,QUESOS,TREGAR QUESOS
6012,Q. UNTABLE CHATEL CIBOULETTE X 180 GRS  TREGAR,GARCIA HNOS AGROINDUSTRIAL SRL LACTEOS,GARCIA HNOS AGROINDUSTRIAL SRL,REFRIGERADOS,LACTEOS,TREGAR LACTEOS
6031,DDL TREGAR X 400 GRS,GARCIA HNOS AGROINDUSTRIAL SRL LACTEOS,GARCIA HNOS AGROINDUSTRIAL SRL,SECOS,LACTEOS,TREGAR SECOS
6062,ARROZ C-LECHE X 180 GRS TREGAR,GARCIA HNOS AGROINDUSTRIAL SRL LACTEOS,GARCIA HNOS AGROINDUSTRIAL SRL,REFRIGERADOS,LACTEOS,TREGAR LACTEOS
6072,Q. UNTABLE CHATEL CLAS TREGAR X 180 GRS TREGAR,GARCIA HNOS AGROINDUSTRIAL SRL LACTEOS,GARCIA HNOS AGROINDUSTRIAL SRL,REFRIGERADOS,LACTEOS,TREGAR LACTEOS
6102,ARROZ C-LECHE Y DDL X 180 GRS,GARCIA HNOS AGROINDUSTRIAL SRL LACTEOS,GARCIA HNOS AGROINDUSTRIAL SRL,REFRIGERADOS,LACTEOS,TREGAR LACTEOS
6104,Q. FONTINA X KG TREGAR,GARCIA HNOS AGROINDUSTRIAL SRL QUESOS,GARCIA HNOS AGROINDUSTRIAL SRL,REFRIGERADOS,QUESOS,TREGAR QUESOS
6105,Q. UNTABLE CHATEL SALAME X 180 GRS TREGAR,GARCIA HNOS AGROINDUSTRIAL SRL LACTEOS,GARCIA HNOS AGROINDUSTRIAL SRL,REFRIGERADOS,LACTEOS,TREGAR LACTEOS
6122,CREMA DE LECHE X 350 GRS TREGAR,GARCIA HNOS AGROINDUSTRIAL SRL LACTEOS,GARCIA HNOS AGROINDUSTRIAL SRL,REFRIGERADOS,LACTEOS,TREGAR LACTEOS
6131,YOGURT CREM FRUT X 125 GRS TREGAR,GARCIA HNOS AGROINDUSTRIAL SRL LACTEOS,GARCIA HNOS AGROINDUSTRIAL SRL,REFRIGERADOS,LACTEOS,TREGAR LACTEOS
6132,YOGURT CREM VAIN X 125 GRS TREGAR,GARCIA HNOS AGROINDUSTRIAL SRL LACTEOS,GARCIA HNOS AGROINDUSTRIAL SRL,REFRIGERADOS,LACTEOS,TREGAR LACTEOS
6134,YOGURT CREM LIGHT FRUT X 125 GRS TREGAR,GARCIA HNOS AGROINDUSTRIAL SRL LACTEOS,GARCIA HNOS AGROINDUSTRIAL SRL,REFRIGERADOS,LACTEOS,TREGAR LACTEOS
6136,YOGURT CREM LIGHT VAIN X 125 GRS TREGAR,GARCIA HNOS AGROINDUSTRIAL SRL LACTEOS,GARCIA HNOS AGROINDUSTRIAL SRL,REFRIGERADOS,LACTEOS,TREGAR LACTEOS
6138,YOGURT FRUTAL FRUT X 160 GRS TREGAR,GARCIA HNOS AGROINDUSTRIAL SRL LACTEOS,GARCIA HNOS AGROINDUSTRIAL SRL,REFRIGERADOS,LACTEOS,TREGAR LACTEOS
6139,YOGURT FRUTAL DUR X 160 GRS TREGAR,GARCIA HNOS AGROINDUSTRIAL SRL LACTEOS,GARCIA HNOS AGROINDUSTRIAL SRL,REFRIGERADOS,LACTEOS,TREGAR LACTEOS
6140,YOGURT DESC FRUTAL FRUT X160 GRS TREGAR,GARCIA HNOS AGROINDUSTRIAL SRL LACTEOS,GARCIA HNOS AGROINDUSTRIAL SRL,REFRIGERADOS,LACTEOS,TREGAR LACTEOS
6144,YOGURT BEBIBLE FRUT X 900 GRS,GARCIA HNOS AGROINDUSTRIAL SRL LACTEOS,GARCIA HNOS AGROINDUSTRIAL SRL,REFRIGERADOS,LACTEOS,TREGAR LACTEOS
6145,YOGURT BEBIBLE VAIN X 900 GRS,GARCIA HNOS AGROINDUSTRIAL SRL LACTEOS,GARCIA HNOS AGROINDUSTRIAL SRL,REFRIGERADOS,LACTEOS,TREGAR LACTEOS
6146,YOGURT DESC FRUTAL DUR X 160 GRS TREGAR,GARCIA HNOS AGROINDUSTRIAL SRL LACTEOS,GARCIA HNOS AGROINDUSTRIAL SRL,REFRIGERADOS,LACTEOS,TREGAR LACTEOS
6147,YOGURT NATURAL S-AZUCAR X 140GRS,GARCIA HNOS AGROINDUSTRIAL SRL LACTEOS,GARCIA HNOS AGROINDUSTRIAL SRL,REFRIGERADOS,LACTEOS,TREGAR LACTEOS
6148,YOGURT ENTERO C-GRANOLA X 155GRS,GARCIA HNOS AGROINDUSTRIAL SRL LACTEOS,GARCIA HNOS AGROINDUSTRIAL SRL,REFRIGERADOS,LACTEOS,TREGAR LACTEOS
6149,YOGURT DESC C-GRANOLA X 155GRS,GARCIA HNOS AGROINDUSTRIAL SRL LACTEOS,GARCIA HNOS AGROINDUSTRIAL SRL,REFRIGERADOS,LACTEOS,TREGAR LACTEOS
6160,Q. DAMBO X KG TREGAR,GARCIA HNOS AGROINDUSTRIAL SRL QUESOS,GARCIA HNOS AGROINDUSTRIAL SRL,REFRIGERADOS,QUESOS,TREGAR QUESOS
6164,Q. PATEGRAS X KG TREGAR,GARCIA HNOS AGROINDUSTRIAL SRL QUESOS,GARCIA HNOS AGROINDUSTRIAL SRL,REFRIGERADOS,QUESOS,TREGAR QUESOS
6171,YOGURT NATURAL ENDULZADO X 280 GRS TREGAR,GARCIA HNOS AGROINDUSTRIAL SRL LACTEOS,GARCIA HNOS AGROINDUSTRIAL SRL,REFRIGERADOS,LACTEOS,TREGAR LACTEOS
6172,YOGURT NATURAL S-AZUCAR X 280 GRS,GARCIA HNOS AGROINDUSTRIAL SRL LACTEOS,GARCIA HNOS AGROINDUSTRIAL SRL,REFRIGERADOS,LACTEOS,TREGAR LACTEOS
6173,YOGURT NATURAL ENDULZADO X 140 GRS TREGAR,GARCIA HNOS AGROINDUSTRIAL SRL LACTEOS,GARCIA HNOS AGROINDUSTRIAL SRL,REFRIGERADOS,LACTEOS,TREGAR LACTEOS
6174,YOGURT FRUTAL CER X 160 GRS TREGAR,GARCIA HNOS AGROINDUSTRIAL SRL LACTEOS,GARCIA HNOS AGROINDUSTRIAL SRL,REFRIGERADOS,LACTEOS,TREGAR LACTEOS
6176,CREMA DE LECHE X 200 GRS TREGAR,GARCIA HNOS AGROINDUSTRIAL SRL LACTEOS,GARCIA HNOS AGROINDUSTRIAL SRL,REFRIGERADOS,LACTEOS,TREGAR LACTEOS
6180,Q. RALLADO X 40 GRS TREGAR,GARCIA HNOS AGROINDUSTRIAL SRL QUESOS,GARCIA HNOS AGROINDUSTRIAL SRL,REFRIGERADOS,QUESOS,TREGAR QUESOS
6181,Q. RALLADO X 120 GRS TREGAR,GARCIA HNOS AGROINDUSTRIAL SRL QUESOS,GARCIA HNOS AGROINDUSTRIAL SRL,REFRIGERADOS,QUESOS,TREGAR QUESOS
6205,Q. BLANCO CLAS X 290 GRS TREGAR,GARCIA HNOS AGROINDUSTRIAL SRL LACTEOS,GARCIA HNOS AGROINDUSTRIAL SRL,REFRIGERADOS,LACTEOS,TREGAR LACTEOS
6211,Q. AZUL X KG TREGAR,GARCIA HNOS AGROINDUSTRIAL SRL QUESOS,GARCIA HNOS AGROINDUSTRIAL SRL,REFRIGERADOS,QUESOS,TREGAR QUESOS
6212,Q. UNTABLE CHATEL JAMON X 180 GRS TREGAR,GARCIA HNOS AGROINDUSTRIAL SRL LACTEOS,GARCIA HNOS AGROINDUSTRIAL SRL,REFRIGERADOS,LACTEOS,TREGAR LACTEOS
6214,Q. BLANCO LIGHT X 290 GRS TREGAR,GARCIA HNOS AGROINDUSTRIAL SRL LACTEOS,GARCIA HNOS AGROINDUSTRIAL SRL,REFRIGERADOS,LACTEOS,TREGAR LACTEOS
6225,Q. MASCARPONE TREGAR X 200 GRS,GARCIA HNOS AGROINDUSTRIAL SRL LACTEOS,GARCIA HNOS AGROINDUSTRIAL SRL,REFRIGERADOS,LACTEOS,TREGAR LACTEOS
6253,RICOTA ENTERA X 290 GRS TREGAR,GARCIA HNOS AGROINDUSTRIAL SRL LACTEOS,GARCIA HNOS AGROINDUSTRIAL SRL,REFRIGERADOS,LACTEOS,TREGAR LACTEOS
6254,RICOTA DESCREMADO X 290 GRS TREGAR,GARCIA HNOS AGROINDUSTRIAL SRL LACTEOS,GARCIA HNOS AGROINDUSTRIAL SRL,REFRIGERADOS,LACTEOS,TREGAR LACTEOS
6313,DDL TREGAR X 200 GRS,GARCIA HNOS AGROINDUSTRIAL SRL LACTEOS,GARCIA HNOS AGROINDUSTRIAL SRL,SECOS,LACTEOS,TREGAR SECOS
6318,YOGURT FRUTAL ARAND X 160 GRS TREGAR,GARCIA HNOS AGROINDUSTRIAL SRL LACTEOS,GARCIA HNOS AGROINDUSTRIAL SRL,REFRIGERADOS,LACTEOS,TREGAR LACTEOS
6319,LECHE CHOCOLATA X 200 ML TREGAR,GARCIA HNOS AGROINDUSTRIAL SRL LACTEOS,GARCIA HNOS AGROINDUSTRIAL SRL,SECOS,LACTEOS,TREGAR SECOS
6338,LECHE ENTERA 12 X 1 LT TREGAR,GARCIA HNOS AGROINDUSTRIAL SRL SECOS,GARCIA HNOS AGROINDUSTRIAL SRL,SECOS,SECOS,TREGAR SECOS
6339,LECHE DESCREMADA 12 X 1 LT TREGAR,GARCIA HNOS AGROINDUSTRIAL SRL SECOS,GARCIA HNOS AGROINDUSTRIAL SRL,SECOS,SECOS,TREGAR SECOS
6359,Q. UNTABLE CHATEL CHEDDAR X 180 GRS TREGAR,GARCIA HNOS AGROINDUSTRIAL SRL LACTEOS,GARCIA HNOS AGROINDUSTRIAL SRL,REFRIGERADOS,LACTEOS,TREGAR LACTEOS
6363,LECHE CHOCOLATA X 1 LT TREGAR,GARCIA HNOS AGROINDUSTRIAL SRL LACTEOS,GARCIA HNOS AGROINDUSTRIAL SRL,SECOS,LACTEOS,TREGAR SECOS
6621,LECHE DESLACTOSADA 12 X 1 LT TREGAR,GARCIA HNOS AGROINDUSTRIAL SRL LACTEOS,GARCIA HNOS AGROINDUSTRIAL SRL,SECOS,LACTEOS,TREGAR SECOS
6627,Q. CREMA CLAS TREGAR X 190 GRS,GARCIA HNOS AGROINDUSTRIAL SRL LACTEOS,GARCIA HNOS AGROINDUSTRIAL SRL,REFRIGERADOS,LACTEOS,TREGAR LACTEOS
6628,Q. CREMA LIGHT TREGAR X 190 GRS,GARCIA HNOS AGROINDUSTRIAL SRL LACTEOS,GARCIA HNOS AGROINDUSTRIAL SRL,REFRIGERADOS,LACTEOS,TREGAR LACTEOS
6640,YOGURT FRUTAL ANA X 160 GRS TREGAR,GARCIA HNOS AGROINDUSTRIAL SRL LACTEOS,GARCIA HNOS AGROINDUSTRIAL SRL,REFRIGERADOS,LACTEOS,TREGAR LACTEOS
6736,YOGURT ENT C-CEREAL X 164 GRS TREGAR,GARCIA HNOS AGROINDUSTRIAL SRL LACTEOS,GARCIA HNOS AGROINDUSTRIAL SRL,REFRIGERADOS,LACTEOS,TREGAR LACTEOS
6737,YOGURT DESC C-CEREAL X 164 GRS TREGAR,GARCIA HNOS AGROINDUSTRIAL SRL LACTEOS,GARCIA HNOS AGROINDUSTRIAL SRL,REFRIGERADOS,LACTEOS,TREGAR LACTEOS
6760,Q. CREMA CLAS TREGAR X 280 GRS,GARCIA HNOS AGROINDUSTRIAL SRL LACTEOS,GARCIA HNOS AGROINDUSTRIAL SRL,REFRIGERADOS,LACTEOS,TREGAR LACTEOS
6782,Q. CREMA LIGHT TREGAR X 280 GRS,GARCIA HNOS AGROINDUSTRIAL SRL LACTEOS,GARCIA HNOS AGROINDUSTRIAL SRL,REFRIGERADOS,LACTEOS,TREGAR LACTEOS
7001,HAMB DE POLLO X 166 GRS GTA,GRANJA TRES ARROYOS SOCIEDAD ANONIMA CONGELADOS,GRANJA TRES ARROYOS SOCIEDAD ANONIMA,CONGELADOS,REBOZADOS,GRANJA TRES ARROYOS RETAIL
7005,BOCADITO POLLO X 5 KG GTA,GRANJA TRES ARROYOS SOCIEDAD ANONIMA CONGELADOS,GRANJA TRES ARROYOS SOCIEDAD ANONIMA,CONGELADOS,REBOZADOS,GRANJA TRES ARROYOS FOOD SERVICE
7008,FIAMBRE PARA EMP X KG JET-FOOD,GRANJA TRES ARROYOS SOCIEDAD ANONIMA REFRIGERADOS,GRANJA TRES ARROYOS SOCIEDAD ANONIMA,REFRIGERADOS,FIAMBRES,GRANJA TRES ARROYOS REFRIGERADOS
7010,JAMON CRUDO MEDIO X KG  JET-FOOD,GRANJA TRES ARROYOS SOCIEDAD ANONIMA REFRIGERADOS,GRANJA TRES ARROYOS SOCIEDAD ANONIMA,REFRIGERADOS,FIAMBRES,GRANJA TRES ARROYOS REFRIGERADOS
7016,BASTONES MOZZ X 5 KG GTA,GRANJA TRES ARROYOS SOCIEDAD ANONIMA CONGELADOS,GRANJA TRES ARROYOS SOCIEDAD ANONIMA,CONGELADOS,REBOZADOS,GRANJA TRES ARROYOS FOOD SERVICE
7032,JAMON COCIDO X KG LA COMARCA,GRANJA TRES ARROYOS SOCIEDAD ANONIMA REFRIGERADOS,GRANJA TRES ARROYOS SOCIEDAD ANONIMA,REFRIGERADOS,FIAMBRES,GRANJA TRES ARROYOS REFRIGERADOS
7033,FIAMBRE PATA CERDO X KG LA COMARCA,GRANJA TRES ARROYOS SOCIEDAD ANONIMA REFRIGERADOS,GRANJA TRES ARROYOS SOCIEDAD ANONIMA,REFRIGERADOS,FIAMBRES,GRANJA TRES ARROYOS REFRIGERADOS
7050,BOCADITO POLLO X 1 KG GTA,GRANJA TRES ARROYOS SOCIEDAD ANONIMA CONGELADOS,GRANJA TRES ARROYOS SOCIEDAD ANONIMA,CONGELADOS,REBOZADOS,GRANJA TRES ARROYOS FOOD SERVICE
7051,MEDALLON POLLO X 1 KG GTA,GRANJA TRES ARROYOS SOCIEDAD ANONIMA CONGELADOS,GRANJA TRES ARROYOS SOCIEDAD ANONIMA,CONGELADOS,REBOZADOS,GRANJA TRES ARROYOS FOOD SERVICE
7053,MEDALLON POLLO J-Q X 1 KG GTA,GRANJA TRES ARROYOS SOCIEDAD ANONIMA CONGELADOS,GRANJA TRES ARROYOS SOCIEDAD ANONIMA,CONGELADOS,REBOZADOS,GRANJA TRES ARROYOS FOOD SERVICE
7055,NUGGETS POLLO X 1 KG GTA,GRANJA TRES ARROYOS SOCIEDAD ANONIMA CONGELADOS,GRANJA TRES ARROYOS SOCIEDAD ANONIMA,CONGELADOS,REBOZADOS,GRANJA TRES ARROYOS FOOD SERVICE
7059,RICOSAURIOS X 1 KG GTA,GRANJA TRES ARROYOS SOCIEDAD ANONIMA CONGELADOS,GRANJA TRES ARROYOS SOCIEDAD ANONIMA,CONGELADOS,REBOZADOS,GRANJA TRES ARROYOS FOOD SERVICE
9074,CREMA DE LECHE 44% X 5 LT MILKAUT,MILKAUT SA,MILKAUT SA,REFRIGERADOS,LACTEOS,MILKAUT LACTEOS
10102,CREMA CHANT TONADITA X 250 GRS (X 6 UN),ELCOR S.A RETAIL,ELCOR S.A,REFRIGERADOS,LACTEOS,TONADITA
10103,Q. CHEDDAR DIP X 180 GRS TONADITA,ELCOR S.A RETAIL,ELCOR S.A,REFRIGERADOS,QUESOS,TONADITA
10104,Q. UNTABLE AZUL X 180 GRS TONADITA,ELCOR S.A RETAIL,ELCOR S.A,REFRIGERADOS,QUESOS,TONADITA
10105,Q. UNTABLE CLASICO X 180 GRS TONADITA,ELCOR S.A RETAIL,ELCOR S.A,REFRIGERADOS,QUESOS,TONADITA
10106,Q. UNTABLE GRUYERE X 180 GRS TONADITA,ELCOR S.A RETAIL,ELCOR S.A,REFRIGERADOS,QUESOS,TONADITA
10107,Q. UNTABLE JAMON X 180 GRS TONADITA,ELCOR S.A RETAIL,ELCOR S.A,REFRIGERADOS,QUESOS,TONADITA
10109,Q. FETAS X 8 U (AMERICANO) TONADITA,ELCOR S.A RETAIL,ELCOR S.A,REFRIGERADOS,QUESOS,TONADITA
10116,BONDIOLA X KG PALADINI,FRIGORIFICO PALADINI SA,FRIGORIFICO PALADINI SA,REFRIGERADOS,FIAMBRES,PALADINI REFRIGERADOS
10173,JAMON COCIDO CLAS X 6 KG PALADINI,FRIGORIFICO PALADINI SA,FRIGORIFICO PALADINI SA,REFRIGERADOS,FIAMBRES,PALADINI REFRIGERADOS
10546,MORT BOLOGNA X KG PALADINI,FRIGORIFICO PALADINI SA,FRIGORIFICO PALADINI SA,REFRIGERADOS,FIAMBRES,PALADINI REFRIGERADOS
10611,SALAME MILAN X KG PALADINI,FRIGORIFICO PALADINI SA,FRIGORIFICO PALADINI SA,REFRIGERADOS,FIAMBRES,PALADINI REFRIGERADOS
10637,SALAMIN PICADO FINO X KG PALADINI,FRIGORIFICO PALADINI SA,FRIGORIFICO PALADINI SA,REFRIGERADOS,FIAMBRES,PALADINI REFRIGERADOS
10686,SALAMIN PICADO GRUESO X KG PALADINI,FRIGORIFICO PALADINI SA,FRIGORIFICO PALADINI SA,REFRIGERADOS,FIAMBRES,PALADINI REFRIGERADOS
10702,SALAME CRESPON X KG PALADINI,FRIGORIFICO PALADINI SA,FRIGORIFICO PALADINI SA,REFRIGERADOS,FIAMBRES,PALADINI REFRIGERADOS
10827,SALCHICHAS X 6 U PALADINI,FRIGORIFICO PALADINI SA,FRIGORIFICO PALADINI SA,REFRIGERADOS,SALCHICHAS,PALADINI VIENAS
11009,MANTECA TONADITA X 100 GRS,ELCOR S.A RETAIL,ELCOR S.A,REFRIGERADOS,LACTEOS,TONADITA
11010,MANTECA TONADITA X 200 GRS,ELCOR S.A RETAIL,ELCOR S.A,REFRIGERADOS,LACTEOS,TONADITA
11303,Q. UNTABLE SALAME X 180 GRS TONADITA,ELCOR S.A RETAIL,ELCOR S.A,REFRIGERADOS,QUESOS,TONADITA
11403,Q. UNTABLE 4 QUESOS X 180 GRS TONADITA,ELCOR S.A RETAIL,ELCOR S.A,REFRIGERADOS,QUESOS,TONADITA
11615,Q. AMERICANO X 140 U TONADITA,ELCOR S.A RETAIL,ELCOR S.A,REFRIGERADOS,QUESOS,TONADITA
12011,MILANESA DE SOJA TRADICIONAL X 340 GRS VEGETALEX,PROTEINAS ARGENTINAS SA,PROTEINAS ARGENTINAS SA,CONGELADOS,SALUDABLES,VEGETALEX RETAIL
12015,HAMB DE SOJA TRADICIONAL 4 X 75 GRS VEGETALEX,PROTEINAS ARGENTINAS SA,PROTEINAS ARGENTINAS SA,CONGELADOS,SALUDABLES,VEGETALEX RETAIL
12018,MILANESA SOJA C-ESPINACA X 340 GRS VEGETALEX,PROTEINAS ARGENTINAS SA,PROTEINAS ARGENTINAS SA,CONGELADOS,SALUDABLES,VEGETALEX RETAIL
12019,MILANESA SOJA C-CEBOLLA X 340 GRS VEGETALEX,PROTEINAS ARGENTINAS SA,PROTEINAS ARGENTINAS SA,CONGELADOS,SALUDABLES,VEGETALEX RETAIL
12021,MILANESA DE SOJA CALABAZA X 340GRS VEGETALEX,PROTEINAS ARGENTINAS SA,PROTEINAS ARGENTINAS SA,CONGELADOS,SALUDABLES,VEGETALEX RETAIL
12023,MEDALLON VERDURA X 300 GRS VEGETALEX,PROTEINAS ARGENTINAS SA,PROTEINAS ARGENTINAS SA,CONGELADOS,SALUDABLES,VEGETALEX RETAIL
12025,MEDALLON ESPINACA X 300 GRS VEGETALEX,PROTEINAS ARGENTINAS SA,PROTEINAS ARGENTINAS SA,CONGELADOS,SALUDABLES,VEGETALEX RETAIL
12032,MEDALLON CAL-AVEN-CHIA X 300 GRS VEGETALEX,PROTEINAS ARGENTINAS SA,PROTEINAS ARGENTINAS SA,CONGELADOS,SALUDABLES,VEGETALEX RETAIL
12033,MEDALLON LEG-QUI X 300 GRS VEGETALEX,PROTEINAS ARGENTINAS SA,PROTEINAS ARGENTINAS SA,CONGELADOS,SALUDABLES,VEGETALEX RETAIL
12050,BURGER 100% VEGETAL X 226 GRS VEGETALEX,PROTEINAS ARGENTINAS SA,PROTEINAS ARGENTINAS SA,CONGELADOS,SALUDABLES,VEGETALEX RETAIL
12051,NUGGETS 100% VEGETAL X 300 GRS VEGETALEX,PROTEINAS ARGENTINAS SA,PROTEINAS ARGENTINAS SA,CONGELADOS,SALUDABLES,VEGETALEX RETAIL
12052,HOT-DOG 100% VEGETAL X 225 GRS VEGETALEX,PROTEINAS ARGENTINAS SA,PROTEINAS ARGENTINAS SA,CONGELADOS,SALUDABLES,VEGETALEX RETAIL
16000,NUGGETS CROCANTE X 6 KG SADIA,QUICKFOOD SA,QUICKFOOD SA,CONGELADOS,REBOZADOS,SADIA FOOD SERVICE
16001,PECHUGUITAS CROCANTE X 6 KG SADIA,QUICKFOOD SA,QUICKFOOD SA,CONGELADOS,REBOZADOS,SADIA FOOD SERVICE
16002,SUPREMITAS CROCANTE X 6 KG SADIA,QUICKFOOD SA,QUICKFOOD SA,CONGELADOS,REBOZADOS,SADIA FOOD SERVICE
16003,BONDIOLA DE CERDO CONGELADA SADIA X KG,QUICKFOOD SA,QUICKFOOD SA,CONGELADOS,CARNES,SADIA FOOD SERVICE
17900,Q. AZUL X KG EMPERADOR,SAVAZ S.R.L,SAVAZ S.R.L,REFRIGERADOS,QUESOS,EMPERADOR QUESOS
17939,SALCHICHA X 6 U FELA,FRIGORIFICO PALADINI SA,FRIGORIFICO PALADINI SA,REFRIGERADOS,SALCHICHAS,FELA VIENAS
20101,Q. CHEDDAR POUCH X 3KG TONADITA,ELCOR S.A FOOD,ELCOR S.A,REFRIGERADOS,QUESOS,TONADITA
20289,LOMO COCIDO X 2 KG PALADINI,FRIGORIFICO PALADINI SA,FRIGORIFICO PALADINI SA,REFRIGERADOS,FIAMBRES,PALADINI REFRIGERADOS
20412,"SALCH C-JAMON X 2,5 KG PALADINI",FRIGORIFICO PALADINI SA,FRIGORIFICO PALADINI SA,REFRIGERADOS,FIAMBRES,PALADINI REFRIGERADOS
20420,"SALCH TRIPLE X 2,5 KG PALADINI",FRIGORIFICO PALADINI SA,FRIGORIFICO PALADINI SA,REFRIGERADOS,FIAMBRES,PALADINI REFRIGERADOS
20503,MORT MINI X 300 GRS PALADINI,FRIGORIFICO PALADINI SA,FRIGORIFICO PALADINI SA,REFRIGERADOS,FIAMBRES,PALADINI REFRIGERADOS
20552,"MORT CILINDRO X 4,5 KG PALADINI",FRIGORIFICO PALADINI SA,FRIGORIFICO PALADINI SA,REFRIGERADOS,FIAMBRES,PALADINI REFRIGERADOS
20727,"Q. DE CERDO X 2,5 KG PALADINI",FRIGORIFICO PALADINI SA,FRIGORIFICO PALADINI SA,REFRIGERADOS,FIAMBRES,PALADINI REFRIGERADOS
20735,LEBERWURST X 250 GRS PALADINI,FRIGORIFICO PALADINI SA,FRIGORIFICO PALADINI SA,REFRIGERADOS,FIAMBRES,PALADINI REFRIGERADOS
21305,Q. FETAS PROVOLONE X 8 U TONADITA,ELCOR S.A RETAIL,ELCOR S.A,REFRIGERADOS,QUESOS,TONADITA
51600,DDL REPOSTERO BALDE X 10 KG VACALIN,ERNESTO RODRIGUEZ E HIJOS SA SECOS,ERNESTO RODRIGUEZ E HIJOS SA,SECOS,SECOS,VACALIN SECOS
51650,DDL FAMILIAR BALDE X 10 KG VACALIN,ERNESTO RODRIGUEZ E HIJOS SA SECOS,ERNESTO RODRIGUEZ E HIJOS SA,SECOS,SECOS,VACALIN SECOS
52677,Q. MOZZ CILINDRO X 3 KG VACALIN,ERNESTO RODRIGUEZ E HIJOS SA LACTEOS,ERNESTO RODRIGUEZ E HIJOS SA,REFRIGERADOS,QUESOS,VACALIN LACTEOS
52806,Q. POR SALUT X KG VACALIN,ERNESTO RODRIGUEZ E HIJOS SA LACTEOS,ERNESTO RODRIGUEZ E HIJOS SA,REFRIGERADOS,QUESOS,VACALIN LACTEOS
52902,Q. CREMOSO X KG VACALIN,ERNESTO RODRIGUEZ E HIJOS SA LACTEOS,ERNESTO RODRIGUEZ E HIJOS SA,REFRIGERADOS,QUESOS,VACALIN LACTEOS
53055,Q. TYBO X KG VACALIN,ERNESTO RODRIGUEZ E HIJOS SA LACTEOS,ERNESTO RODRIGUEZ E HIJOS SA,REFRIGERADOS,QUESOS,VACALIN LACTEOS
54006,MANT. X 200 GRS VACALIN,ERNESTO RODRIGUEZ E HIJOS SA LACTEOS,ERNESTO RODRIGUEZ E HIJOS SA,REFRIGERADOS,LACTEOS,VACALIN LACTEOS
54010,MANT. X 5 KG (BULTO X 4 UNI) VACALIN,ERNESTO RODRIGUEZ E HIJOS SA LACTEOS,ERNESTO RODRIGUEZ E HIJOS SA,REFRIGERADOS,LACTEOS,VACALIN LACTEOS
80201,MC CAIN PURE PAPA EN ESCAMA X 20 KG,MC CAIN FOOD,MC CAIN ARGENTINA SA,SECOS,SECOS,MC CAIN FOOD SERVICE
80835,"MC CAIN CRISPERS X 2,500 KG",MC CAIN FOOD,MC CAIN ARGENTINA SA,CONGELADOS,PAPAS,MC CAIN FOOD SERVICE
81064,"MC CAIN NOISETTE X 2,500 KG",MC CAIN FOOD,MC CAIN ARGENTINA SA,CONGELADOS,PAPAS,MC CAIN FOOD SERVICE
81092,MC CAIN TRAD X 1.4 KG,MC CAIN RETAIL,MC CAIN ARGENTINA SA,CONGELADOS,PAPAS,MC CAIN RETAIL
81109,"MC CAIN TRAD 9X9 X 2,500 KG",MC CAIN FOOD,MC CAIN ARGENTINA SA,CONGELADOS,PAPAS,MC CAIN FOOD SERVICE
81354,"MC CAIN CROSSTRAX X 2,000 KG",MC CAIN FOOD,MC CAIN ARGENTINA SA,CONGELADOS,PAPAS,MC CAIN FOOD SERVICE
81618,MC CAIN CORTE CRINKLE X 600 GRS,MC CAIN RETAIL,MC CAIN ARGENTINA SA,CONGELADOS,PAPAS,MC CAIN RETAIL
81695,MC CAIN HORNEABLE  X 700 GR,MC CAIN RETAIL,MC CAIN ARGENTINA SA,CONGELADOS,PAPAS,MC CAIN RETAIL
81696,MC CAIN TRAD X 700 GRS,MC CAIN RETAIL,MC CAIN ARGENTINA SA,CONGELADOS,PAPAS,MC CAIN RETAIL
81797,MC CAIN CHEESE PILLOWS X 1 KG,MC CAIN FOOD,MC CAIN ARGENTINA SA,CONGELADOS,PICKERS,MC CAIN FOOD SERVICE
81895,"MC CAIN SMILES X 1,500 KG",MC CAIN FOOD,MC CAIN ARGENTINA SA,CONGELADOS,PAPAS,MC CAIN FOOD SERVICE
81981,MC CAIN SMILES X 700 GRS,MC CAIN RETAIL,MC CAIN ARGENTINA SA,CONGELADOS,PAPAS,MC CAIN RETAIL
81996,MC CAIN NOISETTE X 600 GRS,MC CAIN RETAIL,MC CAIN ARGENTINA SA,CONGELADOS,PAPAS,MC CAIN RETAIL
81997,MC CAIN CRISPERS X 600 GRS,MC CAIN RETAIL,MC CAIN ARGENTINA SA,CONGELADOS,PAPAS,MC CAIN RETAIL
82300,"MC CAIN ONE FRY X 2,500 KG",MC CAIN FOOD,MC CAIN ARGENTINA SA,CONGELADOS,PAPAS,MC CAIN FOOD SERVICE
82342,MC CAIN BITE PROVOLONE X 1.05 KG,MC CAIN FOOD,MC CAIN ARGENTINA SA,CONGELADOS,PICKERS,MC CAIN FOOD SERVICE
83345,MC CAIN WAFFLE CONG TRADICIONAL X 210 GRS,MC CAIN RETAIL,MC CAIN ARGENTINA SA,CONGELADOS,PICKERS,MC CAIN RETAIL
83346,MC CAIN WAFFLE CONG CHOCOLATE X 210 GRS,MC CAIN RETAIL,MC CAIN ARGENTINA SA,CONGELADOS,PICKERS,MC CAIN RETAIL
83347,MC CAIN WAFFLE CONG PAN DE QUESO X 200 GRS,MC CAIN RETAIL,MC CAIN ARGENTINA SA,CONGELADOS,PICKERS,MC CAIN RETAIL
83772,MC CAIN SMILES X 400 GRS,MC CAIN RETAIL,MC CAIN ARGENTINA SA,CONGELADOS,PAPAS,MC CAIN RETAIL
83796,MC CAIN BONIATO X 2.5 KG,MC CAIN FOOD,MC CAIN ARGENTINA SA,CONGELADOS,PAPAS,MC CAIN FOOD SERVICE
83915,MC CAIN GOLAZO X 700 GRS,MC CAIN RETAIL,MC CAIN ARGENTINA SA,CONGELADOS,PAPAS,MC CAIN RETAIL
84762,"MC CAIN ARVEJAS X 2,000 KG",MC CAIN FOOD,MC CAIN ARGENTINA SA,CONGELADOS,SALUDABLES,MC CAIN VEGETALES
84763,"MC CAIN BROCOLI X 2,000 KG",MC CAIN FOOD,MC CAIN ARGENTINA SA,CONGELADOS,SALUDABLES,MC CAIN VEGETALES
84764,"MC CAIN CHAUCHA X 2,000 KG",MC CAIN FOOD,MC CAIN ARGENTINA SA,CONGELADOS,SALUDABLES,MC CAIN VEGETALES
84765,"MC CAIN CHOCLO X 2,000 KG",MC CAIN FOOD,MC CAIN ARGENTINA SA,CONGELADOS,SALUDABLES,MC CAIN VEGETALES
84767,"MC CAIN ESPINACA X 2,000 KG",MC CAIN FOOD,MC CAIN ARGENTINA SA,CONGELADOS,SALUDABLES,MC CAIN VEGETALES
85379,"MC CAIN PARRILLERA X 2,500 KG",MC CAIN FOOD,MC CAIN ARGENTINA SA,CONGELADOS,PAPAS,MC CAIN FOOD SERVICE
85774,MC CAIN PICKERS AROS DE CEBOLLA X 1 KG,MC CAIN FOOD,MC CAIN ARGENTINA SA,CONGELADOS,PICKERS,MC CAIN FOOD SERVICE
86109,MC CAIN TRAD X 400 GRS,MC CAIN RETAIL,MC CAIN ARGENTINA SA,CONGELADOS,PAPAS,MC CAIN RETAIL
86110,MC CAIN AIRFRYER X700GRS,MC CAIN RETAIL,MC CAIN ARGENTINA SA,CONGELADOS,PAPAS,MC CAIN RETAIL
86570,"MC CAIN CRINKLE X 2,500 KG",MC CAIN FOOD,MC CAIN ARGENTINA SA,CONGELADOS,PAPAS,MC CAIN FOOD SERVICE
86572,MC CAIN GUACAMOLE X 450 GRS,MC CAIN FOOD,MC CAIN ARGENTINA SA,CONGELADOS,PICKERS,MC CAIN FOOD SERVICE
86576,MC CAIN PULPA DE PALTA X 450 GRS,MC CAIN FOOD,MC CAIN ARGENTINA SA,CONGELADOS,PICKERS,MC CAIN FOOD SERVICE
87407,"MC CAIN SURECRISP 9X9 X 2,500 KG",MC CAIN FOOD,MC CAIN ARGENTINA SA,CONGELADOS,PAPAS,MC CAIN FOOD SERVICE
87411,"MC CAIN SURECRISP 7X7 X 2,250 KG",MC CAIN FOOD,MC CAIN ARGENTINA SA,CONGELADOS,PAPAS,MC CAIN FOOD SERVICE
87470,"MC CAIN GAST X 2,500 KG",MC CAIN FOOD,MC CAIN ARGENTINA SA,CONGELADOS,PAPAS,MC CAIN FOOD SERVICE
89766,MC CAIN BITE ESP/QUESO. X 2 KG,MC CAIN FOOD,MC CAIN ARGENTINA SA,CONGELADOS,PICKERS,MC CAIN FOOD SERVICE
89777,MC CAIN TRIANGULO MOZZARELLA X 2 KG,MC CAIN FOOD,MC CAIN ARGENTINA SA,CONGELADOS,PICKERS,MC CAIN FOOD SERVICE
89778,MC CAIN BASTONES DE MOZZ X 2 KG,MC CAIN FOOD,MC CAIN ARGENTINA SA,CONGELADOS,PICKERS,MC CAIN FOOD SERVICE
92524,"Q. CHEDDAR POUCH X 3,5 KG MILKAUT",MILKAUT SA,MILKAUT SA,REFRIGERADOS,QUESOS,MILKAUT LACTEOS
